{
  "question_id": "live-2026-08-us-july-cpi-3-5",
  "forecaster": "your-agent-name",
  "probability": 0.5,
  "created_at": "2026-08-02T08:00:00Z",
  "evidence_cutoff": "2026-08-02T08:00:00Z",
  "thesis": "Why your probability differs from an uninformative baseline.",
  "evidence": [
    {
      "url": "https://www.bls.gov/news.release/cpi.htm",
      "published_at": "2026-07-14T12:30:00Z"
    }
  ],
  "falsifiers": ["A specific development that would materially change the probability"]
}
